<?xml version="1.0" encoding="UTF-8"?>
<!ELEMENT campi (campo+)>
<!ELEMENT campo (nome, tariffa)>
<!ATTLIST campo 
          fieldID NMTOKEN #REQUIRED
		  disciplina CDATA #REQUIRED>

<!ELEMENT nome (#PCDATA)>
<!ELEMENT tariffa (#PCDATA)>